name,date_time,score,quote,sentiment,reply
ara,2021-05-24 07:46:34,0.8516,No quote,Positive,Really hoping it reviews well. Upwards of 75 on metacritic should be great.
Sanka,2021-05-24 07:46:45,0.6908,quote,Positive,Looking forward to reading it and I'm personally hoping the game turns out to be good
grosvenor92,2021-05-24 07:47:01,0.296,quote,Positive,Yep.
shaneo632,2021-05-24 07:48:47,0.8934,No quote,Positive,"Think reviews will determine a lot, for a lot of people. Hope it reviews well, and I think it will, looks like an interesting and unique game. We need more games like this in the industry."
Nere,2021-05-24 07:48:52,0.9158,No quote,Positive,Weird to think this is finally here :D Depending on reviews this will probably be my first full-price game in a while. It seems pretty fun :)
Chirpy Musa,2021-05-24 07:55:01,0.9272,No quote,Positive,"I haven't read the review yet, but veteran german print magazine M! Games is giving a score of 88/100, (and they usually use the  rating scale in reviews) so pretty excited about this game now."
Seijuro,2021-05-24 07:56:33,0.0,No quote,Neutral,Haven’t canceled my $2.88 preorder yet so I’m looking forward to trying this out
GoldenFlex,2021-05-24 08:00:10,0.2263,quote,Positive,That will be enough to get me invested in the game I think. Waiting to see the impressions and the PS5 version arriving to give this a go.
Ewaan,2021-05-24 08:02:02,0.3612,No quote,Positive,Preloaded on Xbox I am ready
GrimGrinningGuy,2021-05-24 08:02:25,0.8225,No quote,Positive,"Game looks cool. I'll check it when I've got more time, less backlog and likely sale.  Looked cool then, still now. Hope it does well."
nihilence,2021-05-24 08:05:05,0.0258,No quote,Neutral,Son of a bitch was hoping to play this morning with the NZ trick. Hopefully ill have some time tomorrow.
Edward,2021-05-24 08:07:11,0.0,quote,Neutral,5PM CET.
Soggoth,2021-05-24 08:09:31,0.6292,No quote,Positive,"Very interested in how this is gonna be received - they could have basically advertised it with ""AA games are back!"" which means it's gonna have flaws and strengths that are not in AAA games.  Really interested in the game itself too, but very much in the fence if I wanna give any kind of money to THQ."
xyla,2021-05-24 08:17:06,-0.34,quote,Negative,I can see IGN have scored the game a 6. Must be a mistake on their site then
Legacy,2021-05-24 08:17:29,0.4588,No quote,Positive,"My copy will arrive by TH. I’m excited. This looks fun, and damn is it a looker on Series X. Can‘t wait."
drewfonse,2021-05-24 08:26:12,0.8316,No quote,Positive,"Waiting for Amazon to ship my Collector’s Edition and planning to dive into this over the long holiday weekend. Glad to see an OT for this game, will pop back in after I’ve played a bit."
RPG,2021-05-24 08:27:32,-0.296,quote,Negative,Where? I’m on their page and see no score
GoldenFlex,2021-05-24 08:32:20,0.0,quote,Neutral,"The article isn't up but if you scroll down to the bottom, on the right there is an Out this Week section. You can see Biomutant there with a score of 6 on it, along with The Saints Row Remaster (7) and Maneater on Switch (7)."
Legacy,2021-05-24 08:43:24,0.1027,No quote,Positive,"Torn, play this on pc or ps4 pro."
Superkamikazee,2021-05-24 08:46:35,0.9862,No quote,Positive,"Got an early copy at the weekend. Took me a while to gel with the mechanics but I'm now thoroughly enjoying it. The different character builds in this are going to be great and probably the main hook for playing. I've re-made my character a couple of times and prioritised aesthetics over skills.  Some of the story sequences seem a bit rough around the edges, but I can still appreciate what it was going for and I'm finding it a fun experience.  However, I find the dialogue quite annoying as each character speaks a line of gibberish, which you'll likely skip, and then the narrator speaks. If you press X too late you may end up skipping the bit that's actually understandable. It's happened to me on multiple occasions.  I definitely get the sense the scope of this game ballooned, but I'm cool with it and dig the vibe they've gone for. I hope it gets good reviews despite some of the downsides."
bitunoriginal,2021-05-24 08:48:51,0.0,No quote,Neutral,Just waiting on reviews to see if this a day one
AgentOtaku,2021-05-24 08:54:14,0.7845,No quote,Positive,"Yeah, hoping it's good."
Superkamikazee,2021-05-24 08:57:00,0.0,No quote,Neutral,Hopefully the EA pricing error comes through and I can check this out.
CGriffiths86,2021-05-24 08:58:11,0.8591,quote,Positive,"Fantastic OT   I had no idea that you couldn't understand the languages. That is awesome, I'm putting him up high haha."
Huntersknoll,2021-05-24 08:58:37,0.9145,No quote,Positive,I have EA play pro at the moment due to It Takes two so will be giving this a go tomorrow for sure - has less than zero expectations for it which is cool! Hopefully it will surprise me.
Tangyn,2021-05-24 09:06:15,0.5244,No quote,Positive,I'm really hoping this game does well. I've been looking forward to it for years. Can't wait for reviews to drop!
Aesthet1c,2021-05-24 09:08:03,0.6642,No quote,Positive,"I'm hoping the game does well but from what I've seen so far, looks like it will be a 60-70 score game. I do like the design of the character and enemies though. Might be one to to buy when on a 50% discount down the line."
Legacy,2021-05-24 09:09:01,0.5574,No quote,Positive,"Somehow this game has kinda totally snuck up on me, despite it obviously being announced and in development for ages.   Interested to hear impressions in an hour or so."
ghostcrew,2021-05-24 09:29:35,0.0792,No quote,Positive,Have a feeling that this is going to be one of those games that MC’s a 70...but I’m gonna fucking love it. It does so much cool shit and just oozes personality......and im a sucker for anything that has colored loot tiers.
bonch00ski,2021-05-24 09:32:57,0.34,quote,Positive,So even if I bought the game in another country I can play at that time when I switch my XSX to NZ?
luffeN,2021-05-24 09:34:34,0.5994,No quote,Positive,Has anyone ever pre-ordered a digital code from Newegg? I preordered this there with the $10 off coupon and was just curious when Newegg typically delivers the codes. I figured it would’ve been sent right away but looks like I am waiting till tomorrow sometime.
DanteSparda504,2021-05-24 09:35:30,0.34,quote,Positive,I believe you can play tonight at 6pm CST
Marcellus Wallace,2021-05-24 09:42:37,0.4173,quote,Positive,ouch  this really looks like it may be divisive
catpurrcat,2021-05-24 09:47:57,0.3182,No quote,Positive,Reminder that it was developped by a team of 20 persons. Please manage your expectations.
Oreiller,2021-05-24 09:55:21,0.7307,quote,Positive,yep!  This is kind of a bad take. I wouldn’t expect a triple A experience but small teams have made plenty of awesome games.
DisturbedSwan,2021-05-24 10:00:30,0.2837,No quote,Positive,"Got my Collector's Edition through the post on Saturday but haven't played it yet, still need to finish up some stuff on RE8 before I dive into this. Really looking forward to it though, hoping for good/great reviews."
theytookourjobz,2021-05-24 10:03:10,0.0,quote,Neutral,I don’t think it’s a midnight release. Unlocks on Xbox via NZ in 9 hours.
Blade24070,2021-05-24 10:03:27,0.714,quote,Positive,"I’m sure it wasn’t intention, but that’s pretty demeaning to the devs."
Marcellus Wallace,2021-05-24 10:04:25,-0.4215,quote,Negative,"Kind of a jackass comment, huh?"
slasherjpc,2021-05-24 10:12:12,0.0,No quote,Neutral,For a 20 person team I'm blown away with my time spent. 20 hours and still so much I can do and areas I haven't been to yet.
sugarmonkey,2021-05-24 10:17:17,0.836,No quote,Positive,"Thanks for the OT, OP. Seeing some concern about scoring, and I’d like to be added to the “I like AA games scored in the 70s” group. Maybe it’s because I’m no longer in a targeted demographic, but more likely it’s that I’d rather play a game that’s janky because more time was spent on cool ideas rather than commercial polish."
More_Badass,2021-05-24 10:19:09,0.5256,quote,Positive,Any more impressions you could share?
shinobi602,2021-05-24 10:22:24,0.0,No quote,Neutral,I'm  waiting to understand how involved of a narrative this game has. I haven't gotten that answer the entire time since the very first announcement so I'll wait for reviews.   If it's mostly superficial or surface level stuff I might not be into it.
GoldenFlex,2021-05-24 10:23:45,0.8242,quote,Positive,"Ah I’m the opposite, I want an open world fun game with little story. Something like breath of the wild is what I’ve been hoping for here."
TheSix,2021-05-24 10:28:03,-0.6808,quote,Negative,Please stop offering bad takes when no one asks for them
DisturbedSwan,2021-05-24 10:29:58,-0.2732,No quote,Negative,Think reviews drop at 4PM BST.
deanna_beanna,2021-05-24 10:33:02,0.7269,quote,Positive, Played a little with an early copy. They definitely tried with a story but I have had 0 investment in it. The morality system the game has is interesting but minimalist imo
Nameless,2021-05-24 10:33:29,0.5574,No quote,Positive,My only lingering questions are around the nature of exploration and the sense of discovery. Hopefully it's player-driven and organic as opposed to the basic checklist-y structure we see way too often.
benzopil,2021-05-24 10:34:31,0.0,No quote,Neutral,N/A
Hispanicguy,2021-05-24 10:35:04,0.4588,No quote,Positive,I left some impressions after 15 hours here:    Some screenshots as well.
That1GoodHunter,2021-05-24 10:37:13,0.0,quote,Neutral,"Oh boy, that's.... "
shaneo632,2021-05-24 10:38:49,0.34,quote,Positive,Wow they put 75 hours into this but were lukewarm on it.
Syranth,2021-05-24 10:41:13,0.0,No quote,Neutral,Forbes took their review down. Too early.
ConfusedOwl,2021-05-24 10:42:53,0.6249,No quote,Positive,I'm going to give this a go on PC. It gives me Piranha Bytes vibes so if they can capture that feeling of exploration at all it's going to be a winner in my eyes no matter how it reviews.
benzopil,2021-05-24 10:44:46,0.0,quote,Neutral,I can open it
littlegrasshopper,2021-05-24 10:45:10,0.4019,No quote,Positive,Can't seem to find an answer anywhere.... Does the PC version have any RTX or DLSS support?
Syranth,2021-05-24 10:45:35,0.0,quote,Neutral,Hmm. The link above takes me to an Oops page.
PowerUp,2021-05-24 10:46:04,0.4939,No quote,Positive,Ours will be live in 15 minutes -   Posting the link early cause it's nearly 1am in Australia and I've got to get up early.  Night y'all. Enjoy the review
tophu,2021-05-24 10:46:20,0.3612,quote,Positive,75 hours? jfc… sounds like a bloated game.
starfoxxxy,2021-05-24 10:48:30,-0.5423,No quote,Negative,I have a feeling this is gonna be a solid 7 kind of game. A lot of it still looks rough as hell to me
Tovarisc,2021-05-24 10:50:47,0.0,quote,Neutral,It's in your browsers cache.
benzopil,2021-05-24 10:51:21,0.4404,quote,Positive,"Ah, thanks Apple then. Anyway 10 minutes left."
Oreiller,2021-05-24 10:51:24,0.3182,quote,Positive,How is it demeaning to state there were 20 devs on the team? Please elaborate.
starfoxxxy,2021-05-24 10:52:21,0.0,quote,Neutral,because there are games made by small teams that are incredible?
VinceK,2021-05-24 10:55:15,0.8687,No quote,Positive,I really hope this game unlocks tonight at Midnight in the US would love to play it some tonight before sleeping.
Legacy,2021-05-24 10:58:27,0.4215,quote,Positive,"Lol what a comment, don't expect too much from small team dev. Got it"
Nameless,2021-05-24 10:58:41,0.5719,quote,Positive,"Furry over the top ELEX is pretty much exactly what I want this to be, heh."
shaneo632,2021-05-24 11:05:15,-0.0956,No quote,Negative,"My review just went up. I gave it a 6/10. Neat open world and characters, but it feels incredibly dated gameplay-wise. A lot of jank and copy-paste stuff. The campaign is very short (8-10 hours if you go critical path and use fast travel) but even then it's very repetitive. Played a bit of the side missions but it all seems very generic fetch quest-style and therefore quite forgettable.  "
Garbrenn,2021-05-24 11:06:44,0.6486,quote,Positive,You should always temper your expectations with every new IP and new studio but some amazing games have been made with smaller teams man.
Oreiller,2021-05-24 11:08:49,-0.4022,quote,Negative,"Did I say otherwise? Did I say the game wasn't going to be good?   Saying people should manage their expectations isn't the same as saying the game was going to be bad. I do realize I didn't manage to relay what I meant though so sorry for that I guess, I'll edit my post."
slasherjpc,2021-05-24 11:15:10,-0.7269,quote,Negative, So there is a story. There are sorta multiple here. Without spoiling too much here is sorta the different things.  -Flashbacks involving you as a child and a personal revenge element -The world ending and needing to stop the world eaters -the tribes you're trying to unite -some poster/mural esq that when found the narrator gives background info on how the world changed the way it did - Also some suggestions of something else involved possible? Really hard to describe without spoiling.  Hope that helps.
ConfusedOwl,2021-05-24 11:18:03,0.8593,quote,Positive,Absolutely. Piranha Bytes games rarely review above a 7 and I love them. Hopefully Biomutant can find an audience that appreciates it because it looks like reviewers are being really harsh on it.
More_Badass,2021-05-24 11:19:02,0.0,No quote,Neutral,Divisive and janky but unique? I’m in
slasherjpc,2021-05-24 11:19:04,-0.1109,quote,Negative,"If you thought all the side stuff was forgettable, my guess is some of the neat ones you didn't come across?  or maybe they just didn't wow you?"
BluePhoneBox,2021-05-24 11:23:56,0.296,quote,Positive,", and I think it just dissuaded me from an impulse purchase. It's a lot to digest but this piece from the first paragraph jumps out  They also mention encountering 18 different crashes playing on the PS5, happening almost hourly.  Edit: Fixed link"
pappacone,2021-05-24 11:26:43,0.0,quote,Neutral,it's not really divisive
ConfusedOwl,2021-05-24 11:27:22,-0.4767,quote,Negative,Unless Batman is in Biomutant I think you linked the wrong review.
BluePhoneBox,2021-05-24 11:29:17,-0.0772,quote,Negative,"Gah. Sorry about that, fixed the link."
ConfusedOwl,2021-05-24 11:32:06,-0.6124,quote,Negative,No worries :P.
Marcellus Wallace,2021-05-24 11:33:49,0.296,quote,Positive,Yep. Can't wait.
Juturna,2021-05-24 11:35:58,0.0,No quote,Neutral,"These types of games are right up my alley, so even with jank, I'm in."
Buckle,2021-05-24 11:46:23,0.7355,quote,Positive,"This basically sounds like every eurojank RPG I ever fell in love with.  Rough as hell but a unique, interesting world.   Thought reviews would diminish my excitement but I'm actually kind of more intrigued now, weirdly enough? We'll see."
Hyperfludd,2021-05-24 11:48:08,0.3182,No quote,Positive,Curious to see if that EA Desktop App version actually gives me the game when this comes out later. Picked it up when it had that price glitch.
Pey,2021-05-24 11:56:50,0.0,No quote,Neutral,"Lots of 4k pics, first 85 minutes and videos of the four main bosses:               "
Tangyn,2021-05-24 12:23:23,0.0,No quote,Neutral,Do VPNs normally work with EA Desktop or is it just not working for me?
antispin,2021-05-24 12:44:08,-0.3597,No quote,Negative,The narrator can by muted completely: No voice over just subs for the animal chatter.
Rakuyo,2021-05-24 13:36:21,0.7777,No quote,Positive,"Reviews are like I expected. Preloaded and can't wait for tomorrow, I'm sure this will be something special!"
ghibli99,2021-05-24 13:55:14,0.2926,No quote,Positive,Still no update on when preload will be available for EA Desktop?  The game world looks really nice!
Gyroscope,2021-05-24 13:57:34,0.4111,No quote,Positive,"Quite interested in the game and would like to get it for XSX due to the performance, but it's priced at $76.99 CAD there. But it's $59.99 on PS and Steam. Anyone say or know why?"
Tawantabe,2021-05-24 13:59:34,0.34,No quote,Positive,"Excited for this one, gonna turn the narrator off and just get deep in this mumbling animal world."
Clownio,2021-05-24 14:06:42,0.4588,No quote,Positive,More Series S footage   I have a feeling people will like this game more than reviewers.
Rizific,2021-05-24 14:10:59,0.3612,quote,Positive,for anyone else like me looking for this information 
Yinyangfooey,2021-05-24 14:13:35,-0.1406,quote,Negative,"See, it  good, but it bad. That was my biggest issue where it just feels like your entire arsenal is made out of paper"
unfashionable,2021-05-24 14:23:15,0.4329,No quote,Positive,"so is there any guidance on when PS5 BC version is no longer running at 1080?  Excited to play the game so likely will play the moment its out. but if it was ""any day now"" I would wait  - edit also PS5 runs 1080 at a locked 60 fps right?"
Clownio,2021-05-24 15:59:22,0.1103,quote,Positive,I didn't get that feeling playing through the entire game
ShabbadooJr,2021-05-24 17:02:47,-0.0516,No quote,Negative,Biomutant is working for me on Xbox using the NZ trick.
F2BBm3ga,2021-05-24 17:07:59,0.264,quote,Positive,"the fuck? Why do PC users have to play it later than console? Makes no sense, just make the shit at the same time"
APerfectOrganism,2021-05-24 17:18:26,0.0,quote,Neutral,Just tried can't get it to work.
TheWorthyEdge,2021-05-24 17:18:58,0.0,quote,Neutral,Try Singapore. That worked for RE8.
APerfectOrganism,2021-05-24 17:20:31,0.128,quote,Positive,No such luck.  Trying Hong Kong too.  EDIT: no luck on any of the usual location trickery
ShabbadooJr,2021-05-24 17:23:42,0.0,quote,Neutral,Hmm. I bought my code from NewEgg so I don't know if that makes a difference or not.
unfashionable,2021-05-24 17:24:32,0.9783,No quote,Positive,man really excited to play this. expectations tempered by reviews but love the art style so much (watched videos of a ton of different areas)  and sounds like its a game nice to have digital just play a little at a time interspersed with other games  I loved fenyx and I am getting a vibe of that game with less budget but more depth of systems
Edward,2021-05-24 17:26:21,0.6267,quote,Positive,I tried all 3 and none worked unfortunately. The NZ xbox site says 10am 25th so i am hoping it will work in 30+ min.
APerfectOrganism,2021-05-24 17:27:22,0.0,quote,Neutral,My thoughts exactly.
Ricker,2021-05-24 17:39:27,0.3919,quote,Positive,"Sometimes the Store does that and only have the pre order up but with bundles(mercenary bundle)...as soon as it goes Live,it will probabbly have the 59.99 version up as well."
AJUK,2021-05-24 17:40:15,0.4019,No quote,Positive,I think I’ll definitely pick this up sometime down the line.
Mudo,2021-05-24 17:46:18,0.9052,No quote,Positive,"I already posted in the review thread, but want to check in here too :) Great OP and very informative as I didn't know much about the actual game until today. I read a bunch of reviews and the spread of scores is crazy, but I still think this is going to be right up my alley.   Is this coming out at 11pm/12am tonight like most bigger releases? I am buying on the XSX"
Marcellus Wallace,2021-05-24 17:48:09,0.34,quote,Positive,Set it to New Zealand and play in 12 minutes
Lowrys,2021-05-24 17:49:29,-0.296,quote,Negative,"The only thing deeper than Immortals seems to be weapon customisation, and even then it's mostly cosmetic."
Buckle,2021-05-24 17:52:35,-0.296,No quote,Negative,"No way to VPN this on Steam, is there?"
rostad,2021-05-24 18:05:53,-0.296,No quote,Negative,Did EA Desktop app stop working for anyone else? 
JCizzle,2021-05-24 18:25:45,0.4588,quote,Positive,Any luck?
Rizific,2021-05-24 18:35:03,0.0,No quote,Neutral,anyone know if steam is doing a pre load?
Juturna,2021-05-24 18:48:05,-0.0516,No quote,Negative,New Zealand trick didn't work just now
Edward,2021-05-24 19:33:12,-0.4192,quote,Negative,I just tried and it didn't. Not sure when exactly the fuck this game is supposed to go live. I'm starting to wonder if it's even going to be live at midnight EST at this point.
Gyroscope,2021-05-24 19:41:11,0.4926,quote,Positive,Thanks! I'll wait and see for this.
Kalik,2021-05-24 19:53:24,0.0,No quote,Neutral,can you disable the narrator?...I read that there's a slider for his frequency but it didn't mention if you could disable it completely
Mentalist,2021-05-24 20:13:13,0.4767,No quote,Positive,Pre-ordered on GOG based on reviews. Ambitious euro-jank is my kryptonite  Gonna look forward to jumping in tomorrow
Hispanicguy,2021-05-24 20:15:09,0.0,quote,Neutral,"There's a ""Speech"" slider that you can adjust and turn down to 0 so that essentially disables him. Same with Gibberish.  Some shots from Series X:        "
Keldroc,2021-05-24 20:16:38,0.0,quote,Neutral,"It's not, it goes live 10AM EST tomorrow on console."
Buckle,2021-05-24 20:18:31,0.6696,quote,Positive,I dub thee....Bio-Cletus!  I love the CC so much.
Wahad,2021-05-24 20:20:28,0.0,No quote,Neutral,The last one. MAGICAL!
sandboxgod,2021-05-24 21:11:21,0.8362,No quote,Positive,Preordered on Steam. but will sorta wait on fan feedback before playing. That's how I dodged the bullet on Outriders even though I had preordered that one as well. Refunded it right at 2hr mark but this game I think it'll be alright since it's single player so it'll at least be playable I think
John Rabbit,2021-05-24 21:27:41,-0.128,No quote,Negative,"I'm watching Dan Ryckert play this right now and...it looks rough. It also reminds me of Maneater in a few ways I like, but there is an obvious lack of polish on this."
Carbon,2021-05-24 21:48:02,0.2617,No quote,Positive,"There's a lot of things I want to like in this game. But after reading/watching a bunch of reviews, it's sounding like the combat, weapons and abilities need a full top-to-bottom rebalancing. I might wait to jump in then, because fun combat can carry me a long way, even if the story/side quests are only just so-so."
Edward,2021-05-24 22:42:54,-0.6249,quote,Negative,I should have just drove to Wal-Mart at midnight and bought it. What a weird and stupid time to launch a game.
GrimGrinningGuy,2021-05-24 22:45:38,-0.4215,quote,Negative,That’s lame
VinceK,2021-05-24 23:09:00,-0.6825,No quote,Negative,It is kinda bullshit that console digital isn't unlocking tonight like it normally does for games.
DanteSparda504,2021-05-24 23:41:27,0.296,quote,Positive,"I can’t speak for Playstation, but I’ve been playing the digital version on Xbox for nearly an hour now."
DanteSparda504,2021-05-24 23:42:00,0.0,quote,Neutral,It’s been live since 10pm CST.
Kalik,2021-05-24 23:43:34,0.7717,No quote,Positive,"judging from the reviews, the biggest disappointments to me are that the world is empty and the AI is poor...for an open world game that is a huge negative...overall it sounds like a very mediocre, forgettable game with pretty visuals...shame because the game is definitely unique and I was looking forward to playing it...now I'm going to wait for a sale"
aronmayo,2021-05-24 23:43:53,0.1864,quote,Positive,Can I ask how large the game file size is on your Xbox? For me it's 13gb and isn't unlocked. When I go to 'Manage' it says 'Not installed'. So weird. The store page also has a blank release date in Australia despite it already being available in physical stores today.
DanteSparda504,2021-05-24 23:45:21,0.0948,quote,Positive,13.6GB. I will however say that something is definitely up as it says Achievements are not supported. So I’m thinking it may have just glitched and let me in early? But I tried it right at 10pm CST and it loaded right up when it didn’t 5 minutes prior.
VinceK,2021-05-25 00:27:35,0.296,No quote,Positive,"Looking at the timer on the PS4 version, yeah it does not unlock for PS owners for another 9 hours 32 minutes."
MythicReclaimer,2021-05-25 00:34:29,0.7783,No quote,Positive,EA Play Pro says you can download the game on May 25 at 1:00 PM EST and it unlocks at 2:00 PM EST...I guess that is accurate? Gameplay (outside of the collectathon side quest) and the visuals really look intriguing to me. Hopefully the character/weapon customization keeps things interesting enough.
Keldroc,2021-05-25 00:40:19,0.2263,quote,Positive,"Maybe you got lucky, but it still says ""too early"" when I load it on Xbox. They announced it's live tomorrow, and it's said that time and day on the release page for months."
Ahti,2021-05-25 02:35:35,0.0,No quote,Neutral,Got my code from CDkeys.  
Dancrane212,2021-05-25 10:40:09,0.0,No quote,Neutral,N/A
ConfusedOwl,2021-05-25 10:55:05,0.0,No quote,Neutral, Just in case anyone else was wondering about GMG keys.
Marcellus Wallace,2021-05-25 11:25:49,-0.3182,No quote,Negative,Such an odd time to release the game.
northnorth,2021-05-25 11:31:59,0.536,quote,Positive,Came for this. Thank you!!
GrimGrinningGuy,2021-05-25 12:36:38,0.4696,No quote,Positive,Do I need to start as a psi guy to use special powers in the game? Or do all classes unlock them?
DownWithTheShip,2021-05-25 12:58:19,0.0,No quote,Neutral,Up on Steam. Had to restart it.
FLCL,2021-05-25 12:59:24,0.0,quote,Neutral,I think all classes unlock them because I did not go psi guy and I just got my first 2 points to unlock Psi-Powers.
Somewhatgroovy,2021-05-25 13:01:40,0.0,No quote,Neutral,So will that pre-order DLC ever become available post launch day?
MythicReclaimer,2021-05-25 13:01:59,0.34,No quote,Positive,Pre-loading from EA Play Pro.
unfashionable,2021-05-25 13:02:36,0.8511,quote,Positive,Anyh class can get them. however I think the psi ops class gets a 20% boost to energy recovery so its best to pick that class
