name,date_time,score,quote,sentiment,reply
TiagoCosta,2021-05-24 20:14:18,0.4588,No quote,Positive,Gotta move into sequel hype fast.  I got the physical edition on pre order for about that much tbf
ghostcrew,2021-05-24 20:17:12,-0.3802,No quote,Negative,Holy shit Judgement sale already! Already have it on PS4 but I’ll replay it for next gen.
MauroNL,2021-05-24 20:19:22,0.5948,No quote,Positive,Some good 360 prices too. Ikaruga and Radiant Silvergun are not sale regulars FYI.
krat0zs,2021-05-24 20:22:23,0.5868,No quote,Positive,If I could have some sort of assurance Spyro Reignited Trilogy would be put on FPS Boost I would buy it
thediamondage,2021-05-24 20:24:10,-0.6611,No quote,Negative,"I saw wario tweeted that Judgment is Series X|S only and the page seems to say that too, is that a thing? I have a Series X so don't really care but I thought all xbox games were supposed to also run on xbox one's, I guess thats not true?"
ghostcrew,2021-05-24 20:25:15,0.3818,No quote,Positive,NBA 2k21 is £3.99 in Brexit money. Jesus Christ. They love a flash sale.  Obviously just the last gen version which is a bummer.
jokkir,2021-05-24 20:25:23,0.0,No quote,Neutural,Control (regular version) is really cheap now too. $10 CAD
NeptunePirate,2021-05-24 20:25:28,0.0,quote,Neutural,Judgment is a Series X/S only release. Not available for X1.
Seafoam Gaming,2021-05-24 20:26:21,0.0,No quote,Neutural,"Oh damn, the DMC bundle is on sale! definitely grabbing that to try the series"
jokkir,2021-05-24 20:27:05,0.0,No quote,Neutural,Hitman 1 GOTY is on sale too. Finally
ghostcrew,2021-05-24 20:27:13,0.2382,quote,Positive,That’s never been the case. There are (and there will be plenty more) Series X only titles.  MS themselves said they’d keep supporting the Xbox One with crossgen titles for x amount of time but other devs don’t have to stick to that.
CloseTalker,2021-05-24 20:35:56,-0.296,quote,Negative,No reason not to assume it won't be on Game Pass relatively soon
litebrite,2021-05-24 20:37:07,0.0516,No quote,Positive,I guess I'm going to get Lords of the Fallen Digital Complete Edition for $4.49 due to the FPS Boost to 60fps.
Rocketz,2021-05-24 20:40:43,0.0,No quote,Neutural,2K really gonna hold that next gen version hostage at full price.
oni-link,2021-05-24 20:46:19,-0.4149,quote,Negative,"How are the 360 ports?   I think the former is also on PS4, would that version not be better?"
Remeran,2021-05-24 20:49:08,0.6239,No quote,Positive,"Just finished judgement today. Get it everyone, it's amazing!"
OrakioRob,2021-05-24 20:53:15,0.8338,quote,Positive,"Thanks for the tip, grabbing Radiant Silvergun right now. I suck at it, but I love it ^_^"
ZeroMaverick,2021-05-24 20:53:15,0.0,No quote,Neutural,Dude I was just about to buy Judgement on PS5!
Bknbear,2021-05-24 20:56:13,-0.6597,No quote,Negative,i JUST bought far cry 2 smh
JusticeBolt,2021-05-24 20:57:43,0.886,No quote,Positive,I just bought Judgment and Yakuza Like a dragon like 2 days ago. Well...still happy to support the devs they deserve it. Buy it people.
TechMetalRules,2021-05-24 21:00:36,-0.6508,No quote,Negative,Yo! Titanfall 2 for only 3.99! That's an insane deal for anyone who hasn't played it yet.
Absolute,2021-05-24 21:05:08,0.1511,No quote,Positive,Tempted for Judgement but I see it coming to Gamepass at some stage so the penny pincher in me says no. I have so many games to play without spending more money!
Garcia el Gringo,2021-05-24 21:05:14,0.3103,quote,Positive,"On Xbox digitally? If so, and you didn't play over some arbitrary number of hours within the two week window, you can self-service a refund and then repurchase, and if you went over the arbitrary number of hours for the self-service refund, support might (and really should) give you a break with a price adjustment.  "
Hardvlade,2021-05-24 21:05:15,0.5106,quote,Positive,You can grab Ikaruga for free from the Argentinian MS Store in case you wanted to check it out - 
JusticeBolt,2021-05-24 21:21:34,0.5399,quote,Positive,Thanks! I will look into it!
Aselith,2021-05-24 21:22:42,0.0,No quote,Neutural,How's the GI Joe game?
TortadeJamon,2021-05-24 21:24:00,-0.5096,quote,Negative,Not great.  
theAllseeingEYE,2021-05-25 00:00:46,0.9847,quote,Positive,"Both of these are excellent on X360 and essentially flawless. I'd also highly reccomend Guardian Heroes (and Bangai-O HD if you have an active X360) on X360/X1/XS.  I believe they were both ported directly by Treasure, they probably run at 720p but both support auto HDR, and still look quite nice on my LG CX. This is also the only place you can get Radiant Silvergun outside of a Saturn hard copy. Both very highly reccomended.   I don't know how Ikaruga compares to a PS4 version. If the PS4 version is 1080p that might be nice, and the PS4 version might have more trophy points (the X360 game is a live arcade version and only has 200 gamer score). Or you could go for the PC version if you want the best."
Neural,2021-05-25 00:37:20,0.1901,quote,Positive,"My same thought. I'd get it at this price, but I've got the feeling this is a pre-Game Pass sale."
J_ToSaveTheDay,2021-05-25 00:42:07,0.0772,No quote,Positive,"I'm absolutely grabbing Judgment for that price on Friday when I get paid.  29.99 was my buy-in threshold for a double-dip for the next gen version. Kudos to Sega for launching at just 39.99 which is way better than 59.99 or 69.99 for a relatively quick re-release, but wasn't gonna bite until 29.99 or lower. Didn't expect that to hit so soon."
Ratjim,2021-05-25 00:45:46,0.0,No quote,Neutural,Blacksad for $10? They ever fix those borked trophies/achievements?
FUNKNOWN iXi,2021-05-25 00:47:39,0.0,No quote,Neutural,"What happened to that Overwatch for $20 deal, is it over?"
Lothars,2021-05-25 00:52:44,0.0935,quote,Positive,There's a sale starting this week for ps5 games so if it matters you might wanna wait a couple days and see otherwise get it on Xbox.
Mandos,2021-05-25 01:01:08,0.2023,No quote,Positive,"Gotta admit, tempted by that rare sonic unleashed sale"
Chettlar,2021-05-25 01:36:23,-0.5267,quote,Negative,"Trueachievements isn't showing any issues, although it does note no achievements on windows. Well that's dumb."
BananasWithGuns,2021-05-25 01:44:29,0.6486,No quote,Positive,Was going to wait for Judgment on Game Pass but that's actually pretty tempting...
| TrusT |,2021-05-25 02:30:11,0.7059,No quote,Positive,Don't hesitate on Radiant Silvergun for that price. It never goes on sale and the port it truly excellent.
wackojackosnose,2021-05-25 02:37:35,0.6293,No quote,Positive,There's an MS Rewards event for this sale.  It basically says you need to spend £30 by May 31 on the event titles to get 4000 points back. Link to titles doesn't work yet unfortunately. Some impetus to pick up DMC4SE and DMCDE games then.  
The Mango Sentinel,2021-05-25 02:47:11,-0.6808,No quote,Negative,I've been tricked by NBA 2k21 twice now. Bastards.
Shane M,2021-05-25 02:51:07,0.0,quote,Neutural,"The PC version literally needs to be modified to work correctly at 60fps (there's a shutting door somewhere that is timed for the 30fps console versions, so it closes too fast for you to make it at 60fps) and starts to fall apart even more when you raise it beyond that, so I wouldn't count on it."
Chettlar,2021-05-25 03:04:25,-0.3759,quote,Negative,Wait really? That's so weird. I would just have assumed it ran at 60. What the heck.
Shane M,2021-05-25 03:22:02,0.3246,quote,Positive," It seems mixed whether people experience them or not, but it probably doesn't bode well for the game getting FPS Boost either way."
Chettlar,2021-05-25 03:41:55,0.0,quote,Neutural,"Given how the game looks, that is just astonishing."
Chettlar,2021-05-25 04:44:32,-0.3736,No quote,Negative,Ought I just get all the resident evil games in those bundles? Aren't there a few that didn't make it to xbox one? I'm thinking of jumping into the series after a friend of mine did.
Tora,2021-05-25 04:46:51,0.7528,No quote,Positive,"Playing Judgment now, it's really good. Also shocked at just how gorgeous it looks graphically"
krat0zs,2021-05-25 04:49:07,0.2023,quote,Positive,Ah I guess I'll stick with playing it on PS4 Pro then
luffeN,2021-05-25 04:55:11,0.0,quote,Neutural,I am currently on Chapter 9 I think. How many more hours do I have if I go only for the story?
WBacon,2021-05-25 05:01:45,0.0,quote,Neutural,"We more or less have them all: RE0 HD RE1 HD RE2 Remake RE3 Remake RE4 HD RE5 HD RE6 HD RE7 RE8 (Village) RE Revelaitons HD RE Revelations 2 RE Code Veronica X (X360 game, forward compatible)"
DuvalDevil,2021-05-25 05:05:42,0.7773,quote,Positive,Judgment has 13 chapters so I'd say 45 - 60 minutes for each remaining chapter. Maybe a bit longer due to cutscenes.  Judgment is friggin amazing. Everyone should play it!
luffeN,2021-05-25 05:15:58,0.7088,No quote,Positive,Thanks guys! Wish the mods would add a thumbs up button to let the people know that their answers have been read.
oni-link,2021-05-25 05:16:19,0.3421,quote,Positive,"Think I'll get Radiant Silvergun.   Maybe a daft question but this will def work on Series S/X, right?   Is there a way to claim this on a UK account?"
Hardvlade,2021-05-25 05:31:05,0.95,quote,Positive,"Xbox accounts are region free, so you definitely can. I’ve claimed free games from different regions over the years by simply selecting the region store and the free button  Click on the link > select go to Argentina store > click on Gratuito (Free) > gets added to your account > go on your console > ready to install > play"
KomandaHeck,2021-05-25 07:00:39,0.792,No quote,Positive,Saw on hotukdeals that Saints Row 1 and 2 are £1.85 each. Definitely grabbing those.  EDIT: They're cheaper on the Hungary store. Picked up both for just £1! :D
asagami_,2021-05-25 07:12:49,0.5187,quote,Positive,"Holy shit, thanks. I thought you need to change your account region, but this was even easier."
Adryuu,2021-05-25 07:33:08,-0.6072,No quote,Negative,"Flashback is almost bought. Is this version broken or anything I should know? What is it based on in regards to music, cutscenes, graphics, etc. the original pc version? For 4€ from rewards points I can't see how I could be convinced to not buy it unless it's broken or they killed kitties during development or somewhing."
NDA-Man,2021-05-25 10:32:59,0.6478,quote,Positive,"Essentially, the core games of the franchise are all available on Xbone, either natively or backwards compatible. There are caveats, the RE2 and RE3 available are the 2019 and 2020 remakes, which are very different beasts (especially 3r). However, as a newcomer I don't think you're ill-served by them.  Then, there are some spinoff/side games that haven't made the cut, but most of those aren't terribly well-received."
zoodoo,2021-05-25 11:07:40,0.6756,No quote,Positive,"For Hitman, is it better to have all 3 and play 1 and 2 in the 3rd game? Or it does not really matter? What are the major differences?"
deathsaber,2021-05-25 11:11:37,0.9251,No quote,Positive,"Yeah, I'll probably dip with Judgement. I actually really want to really properly delve into Yakuza one of these days (played like half of 0,all of 3, half of 4) since its all on gamepass.  I even own ""Like a Dragon"" but its been never put into my machine because I'm kind of frozen on whether I want to play it now or wait until after playing all the Kiryu games (I know it basically starts a new story/protagonist and genre for the series and can be an entry point of sorts, but has a couple of throwbacks which gives me pause).   But anyway, Judgement is a whole different thing with a sequel coming soon-ish too, so that might be a better entry point for me for this universe."
Arctic Chris,2021-05-25 12:26:45,0.9402,quote,Positive,"The big thing with playing H1 and H2 in Hitman 3 is that you now have the Hitman 3 game engine running in those maps - a solid 60 fps everywhere. Smoother, better lighting - get to use any gadgets you have collected throughout your gameplay in all the maps. Hitman 3 is great, and being able to bring all the old maps to play seamlessly in the new engine is amazing. And Quick Resume works very well when work interrupts a mission."
krg,2021-05-25 12:33:38,-0.3612,No quote,Negative,"sucks that RE7 season pass is not on sale, as always early adopters getting the short end of the stick."
oni-link,2021-05-25 13:57:58,-0.5709,quote,Negative,Another really stupid question  Will doing this get me the English version of the game?
PIMPBYBLUD,2021-05-25 14:05:31,0.0516,quote,Positive,No lies detected. Listen to this man. One of the best 1st person single player campaigns of all time.
Dragonyeuw,2021-05-25 14:09:37,0.7964,quote,Positive,That's pretty much on sale every month now for under $5. At this point they may as well keep it that price lol.
TechMetalRules,2021-05-25 14:34:45,0.5093,quote,Positive,"Oh, haha! I've owned a physical copy since release so this is the first time I've ever checked."
zoodoo,2021-05-25 14:41:44,0.6249,quote,Positive,Ok thanks So I'll hoard Hitman 1 and 2 before buying 3
Dragonyeuw,2021-05-25 14:42:25,-0.3331,quote,Negative," Yeah I got the Origin version for like $5 a few years ago, still ain't played it lol. Damn backlog....."
Rareware,2021-05-25 14:59:30,-0.4215,No quote,Negative,Purchased Agony. Have always been intrigued by the game since its announcement so can’t pass it up for only $3.
Hardvlade,2021-05-25 15:16:09,0.9466,quote,Positive,"Yup! Super easy to do and quite convenient when games are free on other regions. Not as easy if you have to pay for the game (but it's possible!)  It's a good question actually! So the Xbox allows you to download the games depending on the region you're in. So if you claim this license, it will assign the game to your account. If you're using a UK account, it will download the version available in the UK. If you're in Japan, it downloads the Japanese version. The only time it will download a region specific version is IF the game isn't available in your region.  For example, I bought Psycho Pass from the Hong Kong store using my US account. Game was never released in the US on Xbox, so it just downloads the HK version of the game (which has English subtitles)."
oni-link,2021-05-25 16:21:26,0.548,quote,Positive,"I logged into my MS account, then clicked the link and claimed the game, had to muddle through some options and then input a code they sent to my email address. I wasn't sure if it worked as I don't speak Spanish but I checked my Xbox and it's there, so It's downloading now  As I have a UK account and have bought UK games in pounds sterling before I'm assuming it's going to be the UK/English version?  Is this something MS know about and just don't care about? I'll take free games but it feels like an exploit"
Hardvlade,2021-05-25 17:16:49,0.7269,quote,Positive,"yes, you’ll get the version for the region you have your console set to  The way they have their accounts setup, they can be used worldwide. So if you moved to Japan, you could use the same account without starting over. I’ve claimed games from other regions since 2014 without any issues whatsoever. Heck I have gift card currency from other regions on my account. So I don’t think it’s something they’re against.  Only thing they make it difficult (and rightfully so) is buying games from other regions since that could be exploited, but the free ones are fair game since they just let you claim it. If MS was against that, they would’ve stopped it a while back."
TheWorthyEdge,2021-05-25 17:20:26,-0.296,No quote,Negative,No RE3 Remake?
TechMetalRules,2021-05-25 17:22:51,0.8592,quote,Positive,"The game is paced so well and is relatively short, I'd encourage you to bump it up in your que so you can enjoy it before moving onto any larger/longer games you may have."
thankyoumerzbow,2021-05-25 17:23:11,0.1779,quote,Positive,"just as a heads up, i recently played the hitman 2 campaign through hitman 3 and there were a couple of levels that were kinda buggy, nothing gamebreaking but it wasn't a 100% smooth experience"
zoodoo,2021-05-25 17:26:12,0.0,quote,Neutural,And those issues are not in vanilla 2?
thankyoumerzbow,2021-05-25 17:29:14,-0.0477,quote,Neutural,i've never played vanilla hitman 2 so i cant guaranteed it but i googled them when i played it and didnt find any complaints about them online.
zoodoo,2021-05-25 17:29:54,0.6249,quote,Positive,ok good to know
DC5remy,2021-05-23 16:00:15,0.0,No quote,Neutural,I’ve always just turned mine off
Betty,2021-05-23 16:02:24,0.296,No quote,Positive,"It’s main purpose is to capture people’s reactions unwittingly when they pop trophies.  Otherwise yeah, it should be off by default."
Lashley,2021-05-23 16:03:14,0.6486,No quote,Positive,"It should be off by default imo, and shouldn't have the light on when off but when it's on to save battery"
janusff,2021-05-23 16:04:01,0.6204,quote,Positive,"So this happens like, what, one time or the first time someone actually plays an online game with a Dualsense? I don’t think there’s people out there that continually game and not know about the mute button on the controller. It’s really a non issue. Just press a button if you want to not be heard."
EagleClaw,2021-05-23 16:04:14,0.4019,No quote,Positive,"Off should be the standard option, yes"
Grugga Pug,2021-05-23 16:04:21,0.3818,No quote,Positive,"I mean, I love it whenever I get a trophy and it records my reaction. But I totally get it for online matchmaking."
Squarealex,2021-05-23 16:04:39,-0.2263,No quote,Negative,"Off by deafult... yeah..  maybe people confuse, when light of the mic is one, Mic is off..."
Slaythe,2021-05-23 16:04:55,0.0,No quote,Neutural,There is an option to have it off by default.
RecRoulette,2021-05-23 16:05:04,0.0,No quote,Neutural,I turned voice chat off on a system level.
Shining Star,2021-05-23 16:06:18,0.0567,quote,Positive,There are definitely people who don't know haha. I had to make mine off by default too.
InRainbows,2021-05-23 16:07:11,0.0,No quote,Neutural,It’s listening
starfoxxxy,2021-05-23 16:07:27,0.0,No quote,Neutural,They need to patch in that its on mute by default
Jawmuncher,2021-05-23 16:07:32,0.7783,quote,Positive,"Might depend on the games and its community, but I can tell you stuff like Fortnite definitely leans more on a playerbase that legit doesn’t know."
Kuro,2021-05-23 16:10:03,-0.7425,No quote,Negative,It should have been off by default and the light on when the mic is on. Having an orange light on wasting battery for something I don't use is really dumb.
Strikerrr,2021-05-23 16:11:47,0.6605,No quote,Positive,I kinda wish they just put a dedicated push-to-talk button on the controller and have PTT enabled by default.
The Praiseworthy,2021-05-23 16:12:12,-0.7089,No quote,Negative,"Off by default with the FREAKING LIGHT OFF.  Who was behind the idea to have the light on when the mic is off, like seriously this make no sense ????"
Primethius,2021-05-23 16:12:21,0.7161,No quote,Positive,Can't really agree just because it's on my default.  The microphone basically removes the hassle of having to find some alternative mic in order to chat with friends.  I just pop on my Sennheisers and call it a day. It's one of the consoles best additions.
GoldenFlex,2021-05-23 16:12:21,0.7678,No quote,Positive,"It's easy to tell when its off though, the orange light is so bright."
Print_Dog,2021-05-23 16:15:45,0.3089,No quote,Positive,I just turn it off when I'm not using it. Had my PS5 since day one and it hasn't been a problem.
GOOCHY,2021-05-23 16:16:17,0.6908,No quote,Positive,"Off by default should be the standard.   For example, with the default settings, if you're playing Warzone someone can join your party without your input and could be listening to any conversation in the room without your knowledge.   I turned the setting to mute by default right away."
jorgejjvr,2021-05-23 16:17:57,0.3612,No quote,Positive,"You press one button and it mutes, and you can have it be set to mute by default. Not a big deal   My issue is players audio coming out of the controller speaker, why can't I have it come out of the TV like on ps4 or at least get the option?"
Vashetti,2021-05-23 16:22:12,0.0,No quote,Neutural,"With people being so privacy conscious nowadays, you'd think Sony would be setting this to off by default."
cyrribrae,2021-05-23 16:24:38,0.928,No quote,Positive,"I'm pretty sure this is your fault for making any noise whatsoever while gaming. If you can't silence yourself, your hardware, and anyone within a 50m radius, I don't think you can blame You know?   But yes, something like a hardware light would have been great (and barring that, something in a UI overlay)"
LightKiosk,2021-05-23 16:24:57,0.121,No quote,Positive,"It's an option more than anything, and it's a not-bad option for people that generally don't care to spend money on a mic and just want to communicate online, whether that's trash talking or otherwise.   With that said, I've had mine system level muted since day 1 lol."
Belthazar90,2021-05-23 16:30:43,0.0,No quote,Neutural,"There's a system option to disable it by default, just use it"
Kawngi,2021-05-23 16:33:06,0.128,No quote,Positive,I turned it off day 1 and have no desire to turn it back on
WhateverItTakes,2021-05-23 16:33:11,-0.2272,No quote,Negative,"I appreciate the ethos behind 'mic on as default' - getting gamers to be more social, push for potentially more meaningful online experiences. But we know what actually happens in practice is annoying background noise and opening the door to toxic behaviour. So off by default should be the default."
TitanicFall,2021-05-23 16:35:52,-0.34,No quote,Negative,Nah. It works fine. Just because people don't know to turn it off isn't a implementation issue. There's even an LED to let you know when it's off. All it is learning pains that people will eventually get used to.
Shiba,2021-05-23 16:37:35,-0.296,quote,Negative,There’s definitely people that aren’t aware at least in Cold War and Fortnite.
KCroxtonJr,2021-05-23 16:40:37,0.0772,No quote,Positive,"Yeah it 100% should be off by default, no light, and then when you want to talk either press the button or change it to always on by default in settings.  It's a controller, not a headset."
TheRealBigRich,2021-05-23 16:40:40,0.4019,No quote,Positive,I think it should definitely be turned off by default
Ciao,2021-05-23 16:47:46,0.0,No quote,Neutural,People have an audibe reaction when they unlock a trophy? Are you one of those people we see in TV ads for games?
Tripwire-Stone,2021-05-23 16:59:13,0.0,No quote,Neutural,Who has an audible reaction to a trophy?
Cupcake Knight,2021-05-23 17:02:04,-0.5719,No quote,Negative,I hate it glows when it is off. It should be the other way.
Blackthorn,2021-05-23 17:02:29,-0.296,No quote,Negative,Now I’m wondering if people have been hearing me in Battlefront 2 this whole time…
vixolus,2021-05-23 17:02:33,0.484,No quote,Positive,"Some of you have never yelled ""Fuck you!"" to a dark souls boss after dying 40 times to it and it shows."
KalBalboa,2021-05-23 17:02:49,0.8797,No quote,Positive,"It's been great for me, personally, as most of my friends never remembered to pair/charge their microphones in prior generations.  Now we all have microphones every time we jump into a party."
tvpivva,2021-05-23 17:12:30,0.3919,No quote,Positive,"may depend on the games you may play with or without the dual sense there will always be those issues with fortnite, I have mine set to off on a system level and the bright orange led will let me know if I’m a faux pa, but people will still continue to not mute their mics anyway"
zombiejames,2021-05-23 17:17:47,0.6249,No quote,Positive,"As someone who doesn’t own a microphone or a pair of headphones with one built in, it’s a great feature to have."
DarrenM,2021-05-23 17:29:34,0.0,No quote,Neutural,"It’s not something I’ve ever used, I have it set to auto mute when I sign in. I guess it’ll be handy if I ever find myself without a mic"
Chance_Boudreaux,2021-05-23 17:30:37,-0.5719,quote,Negative,"There have been a few times where I've audibly said/yelled ""oh, thank fuck"" after getting some annoying achievements. Usually racing related. The latest being Ratchet & Clank's ."
DumpsterJuice,2021-05-23 17:32:52,0.0,No quote,Neutural,"I think you can turn this off now. I have mine turned off by default. It’s was poorly implemented at first, but they fixed it."
Hyun Sai,2021-05-23 17:35:03,0.3612,No quote,Positive,Poorly executed seemed like the idea of everything regarding the UI...
Baconmonk,2021-05-23 17:37:07,-0.9195,No quote,Negative,"My only experience with it was Destruction All-Stars when it first went up as part of Playstation Plus and this mic was enabled by default, with everyone's voices coming through my stereo speakers (with no clear way to turn it off).  In the two games I played, both lobby's immediate reaction was ""oh shit, what the fuck is this? how do I turn it off?"" Absolute chaos, and probably part of the reason I never came back to the game despite this being patched."
Wein Cruz,2021-05-23 17:37:43,0.6486,No quote,Positive,Eh I like it. Now I can use whatever headphones I want and still chat.  I do agree that it should be muted by default tho
Praedyth,2021-05-23 17:39:56,0.0,No quote,Neutural,"I rarely see anyone using it in Destiny, even in the fireteams section of the companion."
Plax,2021-05-23 17:40:03,0.8074,No quote,Positive,I agree that it's undercooked. I don't know anyone who uses it. All of my friends who are interested in chat have headphones.
CTRON,2021-05-23 17:42:24,-0.3182,quote,Negative,This exactly. It's been implemented the other way around for some odd reason.
Fantastical,2021-05-23 17:43:16,0.5729,No quote,Positive,The light on when the mic is off legit feels like a way to encourage turning the mic on. Very strange.
