name,date_time,score,quote,sentiment,reply
BabyShams,2021-05-25 15:05:38,0.0,No quote,Neutral,"Kingdoms of Amalur Reckoning  It just gets bloated and falls apart in the back half, so I get burnt out and take a break and next thing I know it's been 2 years and I think hey I should restart that. It's happened 3 times."
Agni Kai,2021-05-25 15:06:14,0.788,No quote,Positive,"This could be quite the list, but I'm going to try to keep it short and focused.  Final Fantasy VI I can't. I just can't. I love Final Fantasy, but I can't bring myself to play through this one. I've tried 3 times and I always drop it around 40-50%.  Bioshock This one is interesting, because I love Bioshock Infinite. I just find Bioshock to be dull and brown. I think I dislike the setting? I've tried to play through it twice.  Days Gone Two tries on this one. The first one was about 5 hours. The second time I only lasted 1 hour. I'm tired of open world games, I guess."
Cream Stout,2021-05-25 15:06:28,0.7003,No quote,Positive,pretty sure i've restarted oblivion like 4-5 times only to stop after a couple hours
Pancracio17,2021-05-25 15:06:44,-0.6249,No quote,Negative,If the game is too long I wont restart it even if im lost when I come back to it. Ill remember it after a few hours.
Bengraven,2021-05-25 15:06:49,0.0,quote,Neutral,"I’ll try it again down the road.  I can tell you I’ve tried four times. Because I tried twice on Ps4, once on Xbox, and once on PC. CD project Red got their money! I funded CP77!"
snowhite,2021-05-25 15:06:49,0.2263,No quote,Positive,"Cross Code. Every time I beat the tutorial (which goes on for what feels like an hour), I drop the game, and then have to play the tutorial again cause I've forgotten the game mechanics."
Big_Blue,2021-05-25 15:07:27,0.0,quote,Neutral,Yup
SwampBastard,2021-05-25 15:07:28,0.2023,No quote,Positive,Hollow Knight is the first one that springs to mind. I think I've gotten about 5-8 hours in on three different occasions and it just doesn't grab me enough for me to keep playing.
Bengraven,2021-05-25 15:07:51,-0.802,quote,Negative, Tried that with Fire Emblem but forgot how the time management thing worked and even struggled with the fight I was in.
kodax_shc,2021-05-25 15:08:05,0.1779,No quote,Positive,Skyrim. Easily put 200 hours into it across a couple playthroughs but I haven't ever beat the main story.
Hydeus,2021-05-25 15:08:14,0.0,No quote,Neutral,Octopath Traveler. Everytime I can'zzzzzzZzzzz...
Bigg,2021-05-25 15:08:22,0.8201,No quote,Positive,I've restarted Super Mario RPG like ten times and I always drop off my playthrough. There's so much I like about the aesthetic and tone but it just never grabbed me gameplay wise the same way TTYD did.
Anumariku,2021-05-25 15:09:31,0.274,No quote,Positive,"Xenoblade Chronicles 2. I've tried it three times, even made it ~15-20 hours in the last two times, but just gave up. I really tried to give it a fair shot since so many people praise it, but I just can't seem to enjoy it for myself sadly."
ArcGospell,2021-05-25 15:10:15,0.7475,No quote,Positive,FF Tactics. I’ve had the game the game corrupt my save twice while I was nearing the end and every time I try to play again I just stop in the beginning cause I find the first few hours a slog. Wanna love you game but your not letting me!
arrado,2021-05-25 15:11:17,-0.5953,No quote,Negative,"Witcher 3 and MGS V. But I have no intention to play them anymore, I just don't like them.   I was also quite hesitant on Bloodborne. First time I really didn't like the look and feel of the game. Eventually it clicked and I beat it. Now I played all the Souls games and Sekiro in a timespan of 2 years and FROM is one of my favourite studios"
mangrilla,2021-05-25 15:12:55,0.802,No quote,Positive,"Definitely the Witcher 3. I told myself I'd give it another go whenever they get around putting out the update patch but who am I kidding, I'm never going to.  I've also started Horizon Zero Dawn a few times - most recently put it down a few weeks ago as I had finally gotten to a point where I realized that yes, this is another one of those open world games that includes climbing a tower to unlock the map and just noped out. Maybe the robo-dino trapping mechanics get fun or something later on but that trope killed a lot of interest in proceeding."
spad3,2021-05-25 15:15:26,0.3472,No quote,Positive,"Dishonored, tried so hard to get past the opening i just can't see myself having fun with it."
Truno,2021-05-25 15:15:30,0.5789,quote,Positive,"It's the only Ivalice game that I've played that actually lets you explore Ivalice. The architecture of Rabanstre, Bhujerba, Nalbina and Archadia is fantastic. I do agree about the plethora of wasteland/desert environments, but at least there's some variety with snow near Omisace, the forest near Eruyt Village, etc."
ToughSoundingName,2021-05-25 15:15:44,-0.3804,No quote,Negative,GTA v on every single platform. So boring
timshundo,2021-05-25 15:16:18,0.0,No quote,Neutral,Kingdom Hearts. At least 5 times  I even gave up and just started watching a playthrough online but I couldn’t even finish that 
Precious Tritium,2021-05-25 15:16:22,0.0,No quote,Neutral,The Witcher 3 Fallout 4 Zelda: BOTW  One Day.
Elfgore,2021-05-25 15:16:38,-0.7906,No quote,Negative,"It's just CRPGs. Baldur's Gate, Neverwinter Nights 2, Planescape, Pillars, etc. I should love these games for their writing, but damn do I just hate isometric games."
Paroni,2021-05-25 15:16:50,0.0,No quote,Neutral,Battle Brothers. God I hate and love that game.
Huey,2021-05-25 15:18:07,0.8779,No quote,Positive,BOTW twice. I wish I could love it like so many others do. And I adore every zelda game otherwise :(
PlanetSmasher,2021-05-25 15:18:21,0.34,quote,Positive,"I feel you. I just can't connect with isometric play fields. I've tried so many times and I bounce off of them constantly - the only exception to the rule being Diablo, which isn't a CRPG at all."
Falchion,2021-05-25 15:18:38,0.6124,No quote,Positive,"I've started Wind Waker three different times. Once my save was deleted, once it got corrupted, and once the Wii U I was playing on was taken by my roommate to his next place."
The_R3medy,2021-05-25 15:18:48,0.765,No quote,Positive,"Valkyria Chronicles. I genuinely love the game, and just play it in a few short bursts every few months."
Depressed Panda,2021-05-25 15:19:12,0.0,No quote,Neutral,Witcher 3 multiple times on Xbox and PS
eddiemunstr,2021-05-25 15:19:13,0.3384,No quote,Positive,"Soul Reaver, I honestly dont know what it is that makes me keep doing it either. On paper I should absolutely love the game since its art style, world, and shifting between areas are all things I love. Even the idea in the combat that you have to deal a fatal blow to truly kill an enemy is neat, but for whatever reason I start the game and just quit after a bit."
Hillside,2021-05-25 15:22:24,0.5106,No quote,Positive,"A lot. Like, a   Off the top of my head: Witcher 3, Persona 5, Bloodborne, probably tons from the xbox 360 era"
Torpedo Vegas,2021-05-25 15:23:11,0.0,No quote,Neutral,All of them.
yyr,2021-05-25 15:23:40,0.7964,No quote,Positive,"Ocarina of Time. I loved both original LoZ and LttP (Zelda 2 was alright). But there just wasn't enough action to hold my interest. I've tried 3 separate times, I don't even make it to the Temple of Time before I quit."
ViviGaia9,2021-05-25 15:24:27,-0.5598,No quote,Negative,"Yakuza 0, the start was so freaking slow."
Sword Familiar,2021-05-25 15:24:51,0.3398,No quote,Positive,"I think I've restarted Final Fantasy and Dragon Quest II three times each, but I always end up stopping mid-way. FF is a bit too boring, and DQII is a bit obtuse in where you're supposed to go. I at least want to finish the latter at some point, but we'll see when that'll be."
Neil98,2021-05-25 15:24:55,-0.765,No quote,Negative,Murdered Soul Suspect and Sly 3 are the only ones that come to mind
Stronginthearm,2021-05-25 15:26:42,0.0,No quote,Neutral,I only have two I can't get into:  Hotel Dusk: Room 215 (DS) Final Fantasy II (PSP)
Jakenbakin,2021-05-25 15:26:44,0.0387,No quote,Neutral,Xenoblade Chronicles X and Final Fantasy XV in recent years. I've put about 30 hours into each of them twice and put them down again. I still want to beat XCX one day but I think I'm done trying with FFXV.
Zage,2021-05-25 15:26:56,0.0,No quote,Neutral,The Last of Us.
skysthelimit,2021-05-25 15:27:14,0.2732,No quote,Positive,Pretty much every game I had on PS1/PS2 but that was mostly just because I was young.   More recently I think the only one I can think of that I've put effort into more than once is GTA V. Started it twice on X360 but never completed. Will probably pick it up on PS4 if I decide not to buy a next gen console this year.
hydruxo,2021-05-25 15:28:24,-0.705,No quote,Negative,Both Dishonored games. I just can never get invested enough to get through them. I like the combat and everything but I always drop off.  Also most GTA games. I end up getting sidetracked and mess around running from cops rather than finishing the story.
BadWolf,2021-05-25 15:28:29,0.7065,No quote,Positive,Breath of Fire 3.  There were also FF6 and FF Tactics but I took care of those last year finally.
Manu,2021-05-25 15:29:33,0.0,No quote,Neutral,Drakengard 3
Lari,2021-05-25 15:30:19,0.8071,No quote,Positive,"Yakuza Kiwami.  I played all the way through 0 and loved it, I like the characters, the setting and the story seems interesting up to about 5 hours in. But I played the beginning twice a year apart and i'm still not feeling it. Can't really explain or understand why."
Solobbos,2021-05-25 15:30:29,-0.4019,No quote,Negative,"Ocarina of Time on N64, GameCube, Wii & 3DS. Still can't bring myself to finish the damn game."
ara,2021-05-25 15:30:50,0.7912,No quote,Positive,"I tend to give games multiple fair shakes, so lots. Most recently Doom Eternal, my third time trying to get into it, had tweaked the frustrating cooldown and resource focused aspects of it a bit with mods in hopes that it'd be just plain old hectic fun, but nope, can't do it. It's just not fun for some reason."
JustTeaThankYou,2021-05-25 15:31:41,0.2903,No quote,Positive,"I have a couple of weird thorns in my paw.  - Waking Mars - F.E.A.R - AssCreed 2 - Pillars of Eternity  They aren't bad games, otherwise I wouldn't keep restarting them. But for whatever reason I never finish them. With AssCreed 2 I've done the first hour of that game maybe 4 times. I have no idea why...  It also took me three goes to finish Mass Effect back in the day. I've only tried ME2 once, but I think I have to accept I do not gel with those games."
PassiveObserver,2021-05-25 15:33:59,-0.8556,No quote,Negative,The Last of Us. Forced walking and combat was not fun. Dropped it 3 times smh
bushmonkey,2021-05-25 15:34:59,-0.0672,No quote,Negative,"I have so many:  God of War, Skyrim, GTA 5, Destiny 2, Division 2, Breath of the Wild, Mario Sunshine, No Mans Sky, RE4, Bioshock, Dishonored 1 and 2, Dragons Age Origin, Mass Effect 2, oh and last of us 1 but I did finish 2."
silva1991,2021-05-25 15:36:04,-0.2003,No quote,Negative,"SMT Nocturne. Tried it 2-3 times, but I keep dropping it. It's boring as fuck. Silence protagonist is one thing, but the lack of party members for banter and entertainment makes the journey unbearable. Maybe this stuff gets better with time, but I don't care enough to keep playing."
cosmickosm,2021-05-25 15:36:10,0.0,No quote,Neutral,Horizon Zero Dawn
Gabbo,2021-05-25 15:36:59,0.0,No quote,Neutral,"Pathologic 2, Kona, Invisible Inc, that new version of BloodRayne 2 that was released earlier this year"
Zephyriel,2021-05-25 15:38:15,0.8218,No quote,Positive,"Most significant one for me is Chrono Cross, I'ce started it maybe 3 times, got pretty far at least once, and interestingly I consider it one if my absolute favourite games of all time. I really want to finish it one day."
Magic-Man,2021-05-25 15:38:40,0.9654,No quote,Positive,"Breath of the Wild. I love the game to death (one of my most played games ever, at close to or above 100 hours IIRC) but I take breaks from my Switch every once in a while and I restart the game every time I come back. I just love the Great Plateau section of the game as well. And I never finish the game because I'm always off doing something else, like exploring the world or experimenting with the mechanics."
Yata,2021-05-25 15:39:18,0.1958,No quote,Positive,"SMTIV. I've restarted it 3 times already and never get past the first initial hours. I found the minimal story and characters that are at the beginning interesting, but I always lose complete interest after reaching . It doesn't help that I really dislike the Press Turn System. I still want to beat it one day, because I do find it an interesting game."
Vommy,2021-05-25 15:39:36,-0.2732,No quote,Negative,Skyrim. I always get bored mid way through. After a few years I start anew.
Type-Zero,2021-05-25 15:39:47,0.963,No quote,Positive,"Resonance of fate, Sonic generations, Xcom and Skyrim.   I keep trying to play resonance and then I just stop. I start over again since it's been too long rinse and repeat same with Xcom enemy unknown.   Sonic generations I love the game but I really just love playing modern sonic in green Hill zone and that's it.   Skyrim I made the mistake of playing on ps3 and save become unplayable before finishing. Bought it on pc and I downloaded so many mods and just appreciate all of it the first 10 minutes and stop since I spent all my free time modding it."
Serpico99,2021-05-25 15:43:04,0.0,No quote,Neutral,Sekiro... I beat DS1/DS3/BB but I just don't have it in me with this game. I'm also being slow about completing Demon Souls. It's probably because I did blow back in the day during those games with my roommates taking turns...
TheBaldwin,2021-05-25 15:44:21,0.9728,No quote,Positive,"Witcher 3 is easily the one  It;s really annoying because I really enjoy it but something always seems to get in the way  The first time i tried was in first year of Uni, where I was going out pretty much every day either at lectures/clubs/pubs/restaurants/hanging with flatmates so didn't get time.  Then I attempted it a year later but another game came out that I wanted to play to stopped playing it then.  Then tried playing it again 2 years later but my PC was really breaking and it was summer so my graphics settings where on like low and my FPS was like 35 due to heat and old hardware. Then bought a PS4 and made pretty decent progress through the game.   Now just waiting on the PS5 patch before I jump back in."
JohnnyMoses,2021-05-25 15:49:37,0.0,quote,Neutral,"Same here! PS4 day one, then Steam, then Xbox. Finally finished on Xbox."
BossLackey,2021-05-25 15:51:11,0.886,No quote,Positive,"Nioh.   I'm a big fan of Dark Souls and Ninja Gaiden, so this game is right up my alley. However, two times in a row I got quite far into the game and got distracted by something. Then on my 3rd and 4th attempts I got pretty bored of the first few hours since I played them multiple times already. Making it far easier to fall off of it. Now I'm on my 5th attempt. I love the game, just need to stick out the first few hours (again)."
Ahjumbie,2021-05-25 15:59:54,-0.0516,No quote,Negative,"Uncharted 4- Started it about 4 times and never made it past young Drake and his brother  Fallout 4 - lost count at 3 , don't know either I think it's a decent game  God of War-Started it 4 times so far"
Atolm,2021-05-25 16:30:20,-0.4019,quote,Negative,Same. I start playing it but somehow get distracted.
DarthWalden,2021-05-25 16:33:37,-0.3182,No quote,Negative,"The Witcher 3, and Banjo Kazooie: Nuts and Bolts"
tyfon,2021-05-25 16:50:57,0.5258,quote,Positive,The two that comes to mind for me is TW3 (due to combat) and Breath of the Wild (world feels rather empty and I'm not fond of a lot of the mechanics). I think I've started TW3 two times and BOTW four times with the same result.  I'm going to attempt TW3 again though when the PS5 patch hits some day.  lol I'm almost at the end of the 2nd level (I think). It's not an easy game. But I enjoy it a lot regardless.
kiaaa,2021-05-25 16:53:34,-0.3818,No quote,Negative,"Worst one for me by far is Radiata Stories. I've gone back to that game like 5 times and always fall off 5 hours in for one reason or another. Think I'm done after my last go, though."
Rayasab,2021-05-25 16:54:51,-0.2732,No quote,Negative,"Xeno Wii game, got it 3 times(Wii, new 3DS,Switch) and always drop it after 4 hrs. Witcher 2,3 and most European games other than Beat Saber"
ArtificialBeliever,2021-05-25 16:55:57,0.1672,No quote,Positive,"GTA San Andreas. I bought it for PC, but never made it too far into the game each time I played. Not sure why though."
Eldarr,2021-05-25 16:57:17,0.5734,No quote,Positive,"Fallout 4. I get a couple of hours into it, but then I put it down, not touching it again until I get a sudden will to play it. By then, though, I have completely forget how to play the game and the story, so I have to start over and the cycle repeats. No idea why I can't seem to summon the will to play through it."
ghibli99,2021-05-25 16:58:30,-0.2417,No quote,Negative,". I gotta be on my 4th or 5th try since it originally launched on 360. I have it there, on PC, PS4, and Switch. Always get several hours in and just completely lose interest/focus. I love it too, but something about it just loses its grasp on me after a while."
Ghost of Jhoto,2021-05-25 16:59:34,-0.1779,No quote,Negative,BOTW... always get to the stealth segment and stop playing. I’ll beat it some day.
hasher,2021-05-25 16:59:49,-0.296,No quote,Negative,Dishonored 2 and Dragon Age Inquisition. I need to come to terms with the fact that neither of those games are for me.
Woylie,2021-05-25 17:00:45,0.9825,No quote,Positive,"I’ve done this with a lot of games that people consider “classics” which were a little before my time. I just finished Symphony of the Night for the first time after starting it many times just to drop it early on. I loved SOTN, it’s super charming even if it has its flaws.  I’ll probably try to beat FF6 for the first time later this year, I’ve tried it a number of times and while I’m sure there’s a great game in there, the random encounters just make it feel like such a slog.  I’ve also never beaten either of the first two Zelda games on NES despite starting both of them probably a dozen times each. I know they’re classics for a reason, but I think they might just be a little too dated to be accessible for me.  I also really want to play FE: Genealogy of the Holy War, but despite starting it probably three or four times I’ve never gotten very far. I’m really hoping that Intelligent Systems does a remake of that game, because I think modern graphics/QOL features would really make it more playable for me, since I started FE on the GBA and even those are a little tough to go back to mechanically, after experiencing the increased freedom in classes and character builds (and also casual mode) from Awakening onward."
Yoshimitsu126,2021-05-25 17:22:53,0.3612,No quote,Positive,Starfox adventures. I beat the Giant trex boss at one of the runs though so I think I left at the peak. I didn’t like the combat in that game at all.
SirNinja,2021-05-25 17:25:39,0.5267,No quote,Positive,"This technically doesn't count, but I've only ever finished the main quest of Skyrim once in the 1000+ hours I've put into it. Game is distraction central and I love it."
jmsebastian,2021-05-25 17:26:50,-0.7216,No quote,Negative,"Final Fantasy VI is the big one for me. It's not that I don't like the game, either. For whatever reason, I just have a block where I can't get all that far in it. Over the last year I've managed to finish a lot of games that I've abandoned for whatever reason, so I have hope that someday I'll get through it, but just haven't been able to yet. I think I've attempted a playthrough 3 our 4 times at this point.  Alundra is another one that I genuinely enjoy playing, but just have not been able to get all the way through. Started it a handful of times, and got the farthest I've ever gotten most recently, but gave up on it. I'm not the biggest fan of the types of puzzles it lays out, which may be the reason. It's probably a game that I'll finish before the end of this year though.  Eternal Ring was one that I had this problem with for a long time but finally managed to finish it up not too long ago. It's not very long so I'm not sure why I had so much difficulty with it. I guess having to craft rings for new magic types was enough of a departure from From Soft's other first-person RPGs that it put me off a bit.  Glad I'm not the only one who's struggled with some games that people consider all-time classics."
Violence Jack,2021-05-25 17:27:31,0.4767,No quote,Positive,"Cyberpunk 2077. I got tired of the constant crashes. Once it finally became stable enough for me to play, I gave it up to play something else for now."
Bard,2021-05-25 17:28:15,-0.8957,No quote,Negative,"I can't remember one at the moment, but I know that I have a shit ton of games that I started and stopped playing for whatever reason, and I make it a point to try and continue rather than start over. This includes some obtuse ass RPGs but I'm still trying to get through em."
tryagainlater,2021-05-25 17:29:32,-0.5267,No quote,Negative,Thief Gold. I have Thief 2 installed but feel I can't start it till I finally beat the first game.
Magnus,2021-05-25 17:30:36,-0.4389,No quote,Negative,"This thread speaks deeply to me. I am super guilty of this.  Off the top of my head, though, I can only think of one: - Witcher 3 (must have tried/restarted at least 4 times over the years - the lousy combat and huge-ness end up fatiguing me after 3-5 hours)  I tend to pick up a lot of games for replays (SNES, PS1, etc.) and then never finish them, but end up restarting them a couple times a year, every year. All the DKC games, Mega Man X games, Zelda LTTP, Chrono Trigger, bunch of other 16 bit RPGs, Marios, etc. At least I beat them once, I guess!"
milkyway,2021-05-25 17:30:59,0.659,No quote,Positive,"Metal Gear Solid 3 took me 3 tries because I would get stuck on one of the first missions and get annoyed. Somewhat outdated controls aside, I did finish it finally and turns out it was one of the best gaming experiences I've had in awhile. So good that I subsequently completed 4 and peacewalker."
Xwing,2021-05-25 17:35:16,-0.6705,No quote,Negative,"I realized about a year or two ago that I was horrible about restarting games and not finishing. Since then I've forced myself to get through the 30-45 minutes of confusion of picking up an old save, and then I usually have a blast all the way to the end."
Unaha-Closp,2021-05-25 17:37:59,0.9589,No quote,Positive,"I get the urge to finally figure out and play the Divinity Original Sin games. Be it on PC or on Console. Same with the Pillars of Eternity games. I want to be the kind of person who plays those kinds of games and appreciates them. I am not. I've fired up them all at one point or another, multiple times, to see if this is the day I become the type of person who plays these. Was doing pretty good with Original Sin 2 - got off the first island, was making my way with my companions, then stopped. Some other game would have come out I wanted to play, a less complicated game no doubt, swearing I'll get back....so yeah the Divinity OS games, the Pillars of Eternity games, and other games of the ilk."
BringBackSonics,2021-05-25 17:41:37,0.4215,No quote,Positive,I've never actually completed a Crusader Kings game. I usually get to where I am satisfied and then just restart.
Anustart,2021-05-25 17:42:34,0.6655,No quote,Positive,Mass Effect 1. The gameplay is friggin terrible but people keep saying the series is great. I've tried dammit
deadlygantz,2021-05-25 17:56:33,0.0,No quote,Neutral,Assassin's Creed!
haotshy,2021-05-25 17:59:07,-0.0516,No quote,Negative,"The one that sticks out the most to me is Lost Odyssey. I originally stopped at the first boss of the fourth disc. A few years later I restarted it and got right near the end of the 3rd disc, and that was literally 10 years ago.  Honestly, somehow I mostly remember what's going on with the story, and I think there's an in-game recap thing too, so I've been meaning to go back and finish it after I've gotten some other games out of the way."
Betty,2021-05-25 17:59:20,0.1901,No quote,Positive,Skyrim.  I even tried to just follow the main quest path recently but I got to a part where I needed to buy fancy clothes for a party and had no idea where to go.
Tiny Hawk,2021-05-25 17:59:48,0.1779,No quote,Positive,"Skyrim. I've played it on different platforms with different editions and mods, but never continue after meeting the Jarl of Windhelm."
Kao The Kangaroo,2021-05-25 18:00:00,0.34,No quote,Positive,I've already played Skyrim on 3 different consoles + 4 times on PC only. Never finished the main story...
LilScooby77,2021-05-25 18:01:16,0.0,No quote,Neutral,Horizon Zero Dawn just never clicks with me.
steveovig,2021-05-25 18:11:46,0.5994,No quote,Positive,"Link to the Past. I've been playing it since 93 and I still can't beat it. When I had the cart, it would erase my save. Since the VC I've just been lazy. Last year, I got close and gave up to play something else."
Bengraven,2021-05-25 18:12:42,0.8737,No quote,Positive,I also have put over 100 hours into FO4 and only just got to Valentine in my most advanced of 3 save files between three different systems. I just love building settlements.
