name,date_time,score,quote,sentiment,reply
Thera,2021-05-23 17:47:44,0.2023,quote,Positive,"On by default is unacceptable for privacy reasons. The light is a non issue, you would win 1 minute."
Khanimus,2021-05-23 17:48:56,-0.4576,No quote,Negative,It's total fucking nonsense the way they implemented it
Gravijah,2021-05-23 17:49:01,-0.6486,quote,Negative,"It just shouldn't be on by default, or they should ask you during setup. Being a woman, unaware that your mic is on during online games or other situations, is ripe for harassment."
Dr. Mario,2021-05-23 17:51:51,0.0098,quote,Neutural,"Yes it seems intentional to get people to turn it on. Having it on by default also sounds like a violation of GDPR rules, since voice is considered an identifiable biomarker. Sony appears to be angling for a class action in Europe or else I'm not sure what they're thinking."
NetMapel,2021-05-23 17:52:46,-0.1531,No quote,Negative,"I am ok with the microphone on the controller as I can see its convenience factor. However, it should be off by factory default (I had to go change that myself after learning about it. Not everybody knows about it) AND the light should be OFF when the microphone is OFF. That's the part that annoys me the most about its design."
Lashley,2021-05-23 17:53:32,-0.4019,quote,Negative,its still annoying having an orange light on when something is turned off
Afrikan,2021-05-23 17:54:19,0.5071,No quote,Positive,"I play a bunch of online matches with big groups, and lots of one vs one games.... and it hasn't been a problem. I'm wondering if more people than not, are aware of how the mic works on the controller.  Which PS5 games are yall playing?  I've played Wreckfest (24player races), Fifa 21, Madden 21 (but I wonder if EA has all together removed voice chat in their sports games), Destruction Allstars (before it was removed)......and ColdWar at launch, but haven't revisited in a while.  The few times I've heard clicking is when playing a PS4 racing game... and someone was flicking their stick on turns."
RiOrius,2021-05-23 17:56:48,0.4329,No quote,Positive,"Wait, light on means mic off? Huh... it's possible people in Knockout City have been hearing me talk to my dogs.... like, a lot.  ...although I haven't heard anyone talk to me, so either I'm the only one who doesn't know how to use the mute button, or the voice chat isn't always on? I dunno."
MeltedDreams,2021-05-23 17:57:20,-0.4019,No quote,Negative,The light staying on when mic is muted is legit annoying. Such a baffling decision.
Elementje,2021-05-23 17:57:34,-0.857,No quote,Negative,Most confusing and annoying to me is indeed the light being on when you turn off the mic. I really hate that color of the mic because it's not the same as the light color around the touchpad... Just swap it already! Turn the light off when the mic is off and turn the light on when the mic is on...
Zeal543,2021-05-23 17:57:55,-0.4019,No quote,Negative,"Light on should be mic on, not off. This has to be intentionally misleading for some purpose"
Chamon,2021-05-23 17:58:17,0.0,No quote,Neutural,You can put it off by default
Neuromancer,2021-05-23 17:59:11,-0.5132,No quote,Negative,I have mine muted and have everyone I don't know muted as well.   It's a good idea in theory but in practice random people are terrible and I don't want to talk to them and I don't want them to hear me.
Mugen X,2021-05-23 17:59:29,-0.4215,quote,Negative,"I don’t think it’s supposed to be the primary way for you to chat, it’s a decent option though if you’re without headphones for whatever reason. Personally I’d rather have the option there, but ya in no way is it supposed to change how we communicate online."
RCU005,2021-05-23 18:00:22,0.2144,quote,Positive,"Yes, you can change to off by default in settings, but I think it should be the other way around. You should go to settings to turn it on."
bes.gen,2021-05-23 18:01:26,-0.2023,quote,Negative,"it is. it looks weird on controller's color scheme as well, keeps triggering me. would much prefer no light = mute"
Kupo Kupopo,2021-05-23 18:01:33,0.0,quote,Neutural,"in my opinion, trophy popping should be, too..."
Overflow,2021-05-23 18:35:18,0.2249,No quote,Positive,It would be handy if I didn't already have a good headphone setup. I've used it maybe once for its actual purpose to let a friend know I'm getting my actual headset on. The other dozens of times random strangers in my squad on Battlefield have been privy to some interesting conversations with my GF.
Hybrid Rainbow,2021-05-23 18:42:09,0.4404,quote,Positive,Good thing there’s a setting to turn it off by default.
blaze,2021-05-23 18:49:38,0.8001,No quote,Positive,"It was one of the first things I turned off on a system level, it's ridiculous they've implemented it the way they have given the privacy concerns. The fact that there are  of people who don't realise their mic is on shows that the awareness just isn't there for a lot of people, you can blame them as much as you like but it's not difficult for Sony to just switch the defaults and protect their players more. As others have pointed out, this would potentially have the added benefit of getting rid of the light being on for mute rather than the other way around.  It's just one of the many strange decisions made by Sony with their UI/OS design though."
Isilia,2021-05-23 18:51:51,0.3612,No quote,Positive,"I think the only audible thing I have for a trophy is when I start the game and get one. Like, why."
Nathan,2021-05-23 18:52:09,0.8779,No quote,Positive,"I love the built-in controller mic. My friends and I use it for voice chatting on a daily basis, because it's easier than putting the headset on for quick chats."
Fairxchange,2021-05-23 18:52:16,0.0,No quote,Neutural,Can you turn it off by default in settings anywhere?
GungJoe,2021-05-23 18:53:22,0.3171,quote,Positive,"Happens to me all the time, I’m playing single player stuff and forget I was in a party or other times where I disconnect my headset and the PS5 automatically switches to the DualSense mic.  Happens to my friends too. Not like every day but it happens."
coolasj19,2021-05-23 19:01:02,0.8626,No quote,Positive,It should probably be off by default but I love this dumb little thing. I use it when I’m share playing my buddy and click clack or not it’s just so much easier to turn the TV down a little bit and talk naturally without fetching another device
Chamon,2021-05-23 19:05:10,-0.34,quote,Negative,"Oh, I misunderstood."
Richietto,2021-05-23 19:19:59,-0.4423,No quote,Negative,"It bothers me so much that the orange light means its off. Why not like blue for ""on"" instead?"
onpoint,2021-05-23 19:25:54,-0.34,No quote,Negative,Should be off by default with no lights on regardless of whether or not there are options to turn it off. I swear some people defend anything.
Bradbatross,2021-05-23 19:43:55,0.0,No quote,Neutural,People react when they get trophies?...
JigglesBunny,2021-05-23 19:46:18,0.0772,No quote,Positive,"That orange light stays on, and will continue to for the rest of the console’s life. If I want to talk, I’ll plug in my fucking headset."
travisbickle,2021-05-23 20:02:00,-0.6204,No quote,Negative,"I’ve never seen so many people confused about what a button does when theres a literal icon describing what it does below it.  Next time you complain about hand-holding in a game, I’ll remind you how many here couldn’t comprehend a button with the universal symbol for “mute mic” next to it."
BizzyBum,2021-05-23 20:03:32,0.0,quote,Neutural,I stand up and clap.
Thera,2021-05-23 20:03:58,0.8016,quote,Positive,I agree. My Huawei laptop is also like that. A very bright white LED.
PrynceKee,2021-05-23 20:27:44,0.7269,quote,Positive,i had no idea until now this was a feature. Pretty sure my trophy reactions are crickets lol
endlessflood,2021-05-23 20:39:19,0.4927,quote,Positive,"At least it’s really easy to tell them, since there’s a mic built into your controller. Hit the unmute button and say “hey xXX-360NoSCoPeZ4daYz-xXX your mic is on. Press the button below the PlayStation button to mute it. When it turns orange you’re muted.”"
sun-drop,2021-05-23 21:36:21,0.5789,No quote,Positive,"they have a bright orange light on the very switch you need to press to toggle this on/off .... making this post probably took longer that it would to google what state and how to change the default to off ....   but, yep the default out of the box should be off, but changing the default in settings takes what ... 4 seconds?"
Wrighteous86,2021-05-23 21:42:14,0.0,quote,Neutural,"Ah, a fellow American."
Morolian,2021-05-23 21:43:23,0.5927,quote,Positive,But they need as many easy ways as possible to collect user data for marketing purposes.
Teamocil,2021-05-23 21:52:20,0.9219,No quote,Positive,I love it. it’s so nice to hop into a party without having to put a headset on. Wish Xbox had it too.
Apath,2021-05-23 22:06:56,0.5859,quote,Positive,Having to educate people on a key feature is indicative of a poorly implemented feature.   Playing Destruction Allstars when it was free on plus made it abundantly clear a significant portion of players have their controller mics enabled without realizing it.
xir,2021-05-23 22:12:26,-0.3291,No quote,Negative,I hate mics but o use it as a push to speak if I really need to
Jawmuncher,2021-05-23 22:23:29,0.34,No quote,Positive,I feel bad for anyone subjecting their friends to the Dualsense Microphone if they're not using it as a Push to Talk lol.
El Bombastico,2021-05-23 22:26:20,0.7706,No quote,Positive,"Playing CoD the past couple weeks, so LOVELY to once again have all the twelve year olds shouting racial slurs at me and homophobic insults at everyone.   (I'm being sarcastic, hope that was obvious)"
Adum,2021-05-23 22:26:37,-0.4404,quote,Negative,"I will, if I can ever finish my RE7 Madhouse run :("
FIREKNIGHT2029,2021-05-23 22:46:02,0.0,No quote,Neutural,There is an option in settings to have it off by default. Mine is off by default.
endlessflood,2021-05-23 22:46:18,-0.3818,quote,Negative,"TBF, people with mics on letting you hear their music and/or screaming kids has been a thing since forever."
Plushie Cat,2021-05-23 22:46:51,0.2023,No quote,Positive,"The idea is fine, they just need to turn it off by default."
Lukemia SL,2021-05-23 23:02:06,0.611,No quote,Positive,First thing i turned off in the start up settings when I got mine a couple days ago.  But it’s hella nifty now that i can use my everyday headphones instead of a clunky pair I used to use.
Kyle Cross,2021-05-23 23:05:22,0.4999,quote,Positive,"I play Fortnite with my friend with it always on and I've asked him multiple times if he hears anything and he says no, he only occasionally hear noise while I'm actively speaking. So it seems like it has good noise cancelling/noise gate, at least for a bedroom environment. I imagine if someone is in a very noisy environment with kids and stuff it can suck, but that's any mic."
Expy,2021-05-23 23:20:35,0.0,No quote,Neutural,Wasn’t there an option during initial setup?
njean777,2021-05-23 23:23:59,0.8462,No quote,Positive,"I turned mine off, haven't really thought about it ever since then. But I do agree, it is a nice thought, in practice though, it is nothing more than hearing peoples music/environment 95% of the time while playing online."
Kyle Cross,2021-05-23 23:33:45,-0.4767,quote,Negative,"Oh jeez, that poor DualSense."
Dealer A,2021-05-23 23:34:25,0.3182,No quote,Positive,"Sony, let me turn the mic light off please."
ghibli99,2021-05-23 23:35:20,-0.296,No quote,Negative,No wonder I keep seeing my name and random chat stuff popping up in Monster Hunter World. I didn't even realize what that was about.
Ashes of Dreams,2021-05-23 23:38:12,0.816,quote,Positive,"All the lights, actually. The PS4 light bar didn't bother me too much because it was usually just glowing light into my hands, but now between the light bar facing me and there being a ""MIC MUTE"" light, I've got so much unnecessary light glowing directly at my face. I play in a dark room with the light off because my eyes are easily distracted by things and I want to be able to just focus on the screen.   You can DIM the lights, which can help a bit, but the fact we can't turn them off legitimately makes me want to stop playing on PS5."
StrappingYoungLance,2021-05-23 23:38:30,0.6249,No quote,Positive,"It's a great idea, I just changed the setting to default to off, which is probably what should have been the actual default."
PLASTICA-MAN,2021-05-23 23:40:57,-0.2263,quote,Negative,"OP you do realize you can have it turned off by default from the settings? That is a life savior.  ExactlyI wished that when it's off, the light is not on which is very confusing. This should have been switched.   Also the controller microphone radius is insane much more than any other mics or phones. You can be in another room and very far away and people can still hear very clearly which I didn't expect tbh."
gothmog,2021-05-23 23:43:39,0.3612,quote,Positive,Sounds like you should probably sell it or throw some tape over the lights.
Ashes of Dreams,2021-05-23 23:47:07,0.4215,quote,Positive,I'm not going to sell my PS5 lol
Imran,2021-05-23 23:55:35,-0.3818,quote,Negative,"How defensive do you have to be to see minor complaints and reply ""Guess you should sell it, then"""
OsramTaleka,2021-05-24 00:41:57,0.0,No quote,Neutural,I've already used the built in mic more than I have ever used any mics I needed to plug in on a console.
Kuosi,2021-05-24 00:43:08,0.3412,quote,Positive,"Don't worry, it'll pick up whatever background noise there is at your house"
Tripwire-Stone,2021-05-24 00:48:49,0.4215,quote,Positive,lol
Dr. Mario,2021-05-24 01:39:36,-0.4939,quote,Negative,Making data collection opt-out is another violation of GDPR.
JayBabay,2021-05-24 01:45:20,0.7579,No quote,Positive,"I like it, let’s me plug in better quality headphones and it’s worked well for me so far because I rarely do any online gaming on PS5, but I agree it should be off by default and that was the first thing I did."
travisbickle,2021-05-24 01:56:12,0.0,quote,Neutural,Voice data collection is separate from the use of the mic. During the setup of the console you can opt in or out of voice data collection and still be able to use the mic either way.
MeBecomingI,2021-05-24 02:47:22,-0.8824,No quote,Negative,"The light staying on when it's muted makes total sense... I literally know I've muted my controller when the light is on.  It's literally exactly what they should do and they did it. I'm baffled anyone would think having the light OFF when the controller is muted makes sense. That's pretty dumb. And the light isn't even bright, at all. It isn't like the horrible Xbox controller where I have to put black tape over the fucking thing cause it's so bright and facing me all the time and I can't turn it off or dim it. Shit is blinding and so annoying."
Tommi,2021-05-24 02:52:11,0.0,quote,Neutural,"The opposite makes as much sense, though. Most electronics signal they're on when a light is on. Even many mics do that."
Tiny Chihuahueño,2021-05-24 02:53:16,0.0,No quote,Neutural,"That orange light should be on when the microphone is on, not the other way around. But i guess sony wants to know what you’re saying at all times"
SmilesThatGlow,2021-05-24 03:01:32,0.4404,No quote,Positive,"This thread has helped me realize you can set it to off/mute in the system settings. Didn't realize this was an option, thanks all."
Gvon,2021-05-24 03:09:51,0.9243,quote,Positive,"My Gf actually really liked the feature. I've set it up so it records the 30 seconds prior to the the trophy pop so there is a build up.  Her first game since the PS1 was until dawn. She got into looking through the trophy section as she was looking to 100% it. Some her reactions and the times she's been caught screaming are really funny, and she likes checking them out once in a while.  I have an absolutely hilarious trophy recording that's has me screaming and my gf laughing as her daughter was playing thumper for the first time. It's like a little family moment caught during a gaming session.  If I remember correctly during the set-up of the console it asks you about having the mic on or off by default."
KORNdog,2021-05-24 03:18:22,0.5859,No quote,Positive,I mean. It lights up bright orange when it's muted. Its pretty obvious how the thing works. I can't Imagine many people are actually confused by its functionality.
Skyfireblaze,2021-05-24 03:40:47,0.4657,quote,Positive,"While I agree it should be off by default and the LED reversed like you said, the LEDs on the Dualsense and Dualshock 4 never drew any meaningful amount of battery, it's the touchpad that drains most of it compared to the DualShock 3 as the touchpad is always on."
jacktuar,2021-05-24 03:43:11,0.4215,No quote,Positive,Should be off by default but in general it’s one of my favourite features. I hate GAMER headsets and just getting to chat with my friends as I sit on the sofa is nice.
TsuWave,2021-05-24 03:45:29,0.0772,No quote,Positive,when you’re setting up your console one of the things it asks is if you want to have it off by default
TsuWave,2021-05-24 03:46:02,0.2716,quote,Positive,there is. Kinda weird that in an enthusiast forum people are just overlooking this
EagleClaw,2021-05-24 04:23:40,-0.5862,quote,Negative,"If that is true, then i see no problem. I shouldn't trust every story on the internet."
Jhn,2021-05-24 04:36:07,0.0,No quote,Neutural,"Slightly tangential, but how about the baffling design choice that incoming voice audio is routed  when you don't have a headset plugged in? In which possible scenario is this preferable to just having the audio come through your normal speakers?"
Ravelle,2021-05-24 04:46:35,0.6808,No quote,Positive,"The fact that the mic is on by default seems very similar with games today still having in-game voicechat on by default.   I really don't understand it why they keep insisting that's how we like like, if I want to talk or want to hear anyone I'll turn on the comms."
Gradly,2021-05-24 04:54:02,0.4019,No quote,Positive,They just need to switch values off to on and vice versa. Both functionality and light.
Cats_Schrodinger,2021-05-24 04:59:01,0.2935,No quote,Positive,"My only problem with it is cancellation.  Somehow both button presses and game audio leaks through. These two are quite easy to cancel since you have the input needed to be cancelled.  I really wish it worked better, although games where this is super useful, Sea of Thieves and FH4. The social online experiences are AWOL on PlayStation unfortunately."
gothmog,2021-05-24 09:17:03,-0.3182,quote,Negative,"How dramatic do you have to be to make a minor complaint and then say ""fact we can't turn them off legitimately makes me want to stop playing on PS5""?"
gutterboy44,2021-05-24 09:32:02,0.245,No quote,Positive,"Never used it as a mic and I agree it should default to auto mute. My bigger gripe is that the Pulse headset is not compatible with the controller mute button. You have to use the physical toggle button on the headset to mute. If I use other headphones via, DAC or controller headphone jack, I can quickly mute my mic without taking a hand off the controller. I am a liberal mute button user so I have almost completely stopped using my Pulse headset. A cord is worth the convenience of getting to use that mute button. Also light on for mute makes sense. I don’t want that button glowing the whole time I am on voice chat. But on option to invert it makes sense too because if you are never on voice chat you probably don’t want that light on but always want mute."
TheGhost,2021-05-24 09:41:23,0.6124,No quote,Positive,Off should be the standard as well as any easy to flip switch.
shadow2810,2021-05-24 11:12:20,0.0,quote,Neutural,"provide me an example where light ON = function OFF, light OFF = function ON"
Richietto,2021-05-24 11:18:18,0.5023,quote,Positive,"Service lights with vehicles but yeh consumer electronics don’t work like that, at least not the ones I have ever owned."
TheGhost,2021-05-24 11:20:55,0.0,quote,Neutural,"Turtle beach headsets with the stereo adapter for Xbox  lights up red when it’s off, probably so you realize you’re muted"
Iucidium,2021-05-24 11:20:56,0.0,quote,Neutural,Rest mode orange should be a big enough visual cue.
darfox8,2021-05-24 11:23:55,0.5193,No quote,Positive,"I actually think it's great and it's great that it's on by default.   My main problem with the chat experience is that there doesn't seem to be a way to mute the speaker in the controller without plugging in a headset. I currently have a very weird setup where I listen to my PS5 audio through my computer headset and I frequently am chatting with friends on Discord. Recently I was playing Rust and all the in-game chat was coming through my controller so I'd have to take my headset off and try and hear what people were saying. I haven't found a way to just transmit in-game chat through the TV speakers(sending them through my PC audio mix), PS4 let you do that but PS5 seemingly doesn't."
Jafin,2021-05-24 11:47:00,0.3696,No quote,Positive,"Oh the DualSense mic is on by default? Yikes. I got Overwatch on Switch last year and completely forgot that that game puts you into group voice chat by default. Didn't realise until like my third game that my voice chat had been active the whole dame time because the headphones that I use have an in-line microphone. I didn't hear anybody else talk so hopefully I was the only one actually in there, but who knows. Every kind of voice chat should really be off by default, in my opinion."
MeBecomingI,2021-05-24 23:39:33,0.0,quote,Neutural,"What? What does that have to do with anything I said? The function is the mute button! You press the button to activate the mute function, so now it's ON and thus the light turns ON. Thus the light is OFF when the mute is OFF. Never did I say it should the opposite. Hence why it makes total sense.  Again, it follows standard electronics. You're turning the mute button ON, thus the light goes on."
Thorn,2021-05-24 23:44:08,-0.8481,No quote,Negative,Literally the first thing I did with my PS5 was turn that shit off.  Hell is other people.
Fawz,2021-05-24 23:46:52,-0.5607,No quote,Negative,"The most annoying thing is that if you turn off the Microphone the light turns on instead of the other way around, there's also some controller functionality (ie: Rumble Intensity) tied to it. Does more harm than good IMO"
ArrogantBastard,2021-05-24 23:49:48,-0.25,quote,Negative,"I question it each day, I don't know how light on=off. I'm sure they will patch in a fix for this, but I feel like a dumbass each time I start toggling it."
flyinj,2021-05-24 23:56:06,-0.683,No quote,Negative,I can't believe that a mandatory microphone that I will never use required them to make the worst feeling mushy buttons I've ever used on a Sony first party controller  It's a goddamn shame.   Hopefully they will come out with a mic less dualsense with uncompromised buttons in the future
XR.,2021-05-25 00:01:02,0.0772,quote,Positive,"You can make any arbitrary distinction as to what defines a ""function"", but the default state for any technical machinery is that it's off when no lights are showing, unless it's a red light. If the light is on, the machinery is on.  You can make any statement (affirmative or negative), apply a boolean value and call it a function, but it doesn't make it intuitive."
MeBecomingI,2021-05-25 16:40:24,-0.2273,quote,Negative,"There is no arbitrary distinction to anything. It is literally a mute button; that is it's intended purpose. Which means it has to be activated. Meaning it has to be turned ON which is the ""function"", so the light comes ON. That it as intuitive as it gets. This isn't hard to understand. You're making this way more complicated than it is. The mute is off, so the light is off. The mute is on, the light is on. It still follows the principal for any technical machinery as you stated. It's literally that simple."
HylianMaster2020,2021-05-25 17:06:21,0.5106,No quote,Positive,"Im comfortable with the mic on the Dualsense, we aren’t going back to 360 days."
oni-link,2021-05-24 07:29:58,0.0,No quote,Neutral,I thought this ran at 30fps on Series S?
Milennia,2021-05-24 07:30:52,0.0,No quote,Neutral,Patiently awaiting reviews on this one
Ahti,2021-05-24 07:31:27,0.6988,No quote,Positive,Nice OT! Can`t wait to play this tomorrow!
supercommodore,2021-05-24 07:31:39,0.0,quote,Neutral,I believe someone in one of the earlier threads got an early copy and showed that it has a 60 option on Series S.
Dancrane212,2021-05-24 07:32:06,0.0,quote,Neutral,There's a toggle: 
oni-link,2021-05-24 07:32:14,0.4753,quote,Positive,"oh, nice!"
Fiery Phoenix,2021-05-24 07:32:37,0.3612,No quote,Positive,Feels like a lifetime since this game was first unveiled.
SirMossyBloke,2021-05-24 07:35:47,0.864,No quote,Positive,"Really looking forward to reviews on this. Game looks great, but I'd like to see if it does hold up.   Also, smallest of nitpicks, but it's called EA Play Pro, not EA pro play just FYI."
Soulflarz,2021-05-24 07:41:36,0.6901,No quote,Positive,Really hoping my $3 copy lucks out T_T
Rosvall,2021-05-24 07:41:38,0.0,No quote,Neutral,Anyone know when the game unlocks in New Zealand on xbox? It unlocks 4pm tomorrow here in sweden for some reason.
shaneo632,2021-05-24 07:43:07,0.1027,No quote,Positive,Got my review ready for the embargo drop in 3-ish hours. Looking forward to talking about it.
Dancrane212,2021-05-24 07:44:02,0.3612,quote,Positive,Looks like 11:00am:  
Dancrane212,2021-05-24 07:44:31,0.0,quote,Neutral,Embargo down at 15:00 GMT?
mere_immortal,2021-05-24 07:45:32,0.9595,No quote,Positive,"Not gonna be jumping in anytime soon either way, but I really hope this turns out to be good. It looks like it could be a lot of fun. Looking forward to impressions."
